,,"The present Petition, by invoking Sections 47, 48 and 49 of the Act of 1996, is filed by IMAX, not only against E-City Entertainment (I) Pvt. Ltd. but also other three Respondents on 28/03/2018.","Mr.Jagtiani has placed before the Court the shareholding pattern of Respondent No.1 pursuant to the demerger, which reflect that Respondent No.2 possessed 62.875% of shareholding, whereas Respondent No.4 had 37.121% shareholding in Respondent No.1, whereas one Amit Goenka had the shareholding of 0.004%.","33. Necessity of piercing the corporate veil and making those behind the veil i.e. shareholders liable for the debts of the company, according to Mr.Jagtiani, must meet a very high threshold and the standard to be met for permitting piercing the corporate veil as laid down in Balwant Rai Saluja & Anr. Vs. Air India Limited & Ors.22 is once again relied upon by Mr.Jagtiani. In addition, he has also placed reliance upon the decisions of the Apex Court in Indowind Energy Ltd. Vs. Wescare (India) Limited & Anr.23 and Vodafone International Holdings BV Vs. Union of India & Ors. 24, where the parameters of piercing the corporate veil are set out.

Even Mr.Jagtiani has reiterated the argument that fraud is not the magic mantra to vitiate any transaction, as fraud must be pleaded in detail, with material particulars being divulged as Order VI Rule 4 of the Code of Civil Procedure, 1098 requires a party to give material particulars in cases, where misrepresentation, fraud is alleged and in fact, several courts from time to time have held that the threshold for meeting a case of fraud is extremely high, as in any proceedings, not only the plea of fraud is required to be specifically pleaded, but also proved.

The principle laid down in Bishnudeo Narain & Anr.. Vs. Seogeni Rai & Anr.25, followed the decision in the case of Union of India Vs. Chaturbhai M. Patel & Co. 26, is invoked by Mr.Jagtiani.

22 (2014) 9 SCC 407 23 (2010) 5 SCC 306 24 (2012) 6 SCC 613 25 AIR 1951 SC 280 26 (1976) 1 SCC 747 41/168 CARBP-414-18.odt",,,"127. Respondent/E-city has specifically opposed the Petition on the ground that the Petitioner has assailed the demerger scheme and a specific stand is adopted in the reply filed by it that the Petition is filed to enforce the foreign award not only against Respondent No.1, but against Respondent Nos.2 to 4 on the premise that the demerger scheme by which assets of Respondent No.1 were validly and legally transferred in favour of Respondent Nos.2 and 3 are alleged to be fraudulent transfers, in order to defeat the foreign awards in its favour.","During this period, IMAX did not file any application for enforcement of the foreign award, but it chose to pursue the execution proceedings before the Court in Canada and USA.",,It is necessary to note the sequence of incorporation of the Respondent Nos. 2 and 3 and as to how the schemes of De- merger operated.
,,,36/168 CARBP-414-18.odt,"34. Referring to the observations of the Apex Court in the case of Chloro Controls India Pvt. Ltd. Vs. Severn Trent Water Purification Inc. & Ors.27, when the Hon'ble Supreme Court pronounced upon an issue as to whether a party could invoke arbitration in respect of an arbitration agreement to which it was not a signatory; and if it can do so, the parameters within which such invocation would be invalid, Mr.Jagtiani has clarified that Chloro Controls India Pvt. Ltd. was rendered in the context of an expressed statutory provision in Part II to extend the arbitration agreements to non-signatories, namely, Section 45 of the Act. According to him, the Apex Court permitted impleadment of the party at the pre-arbitration stage. However, it was reiterated that ordinarily an arbitration agreement takes place between the persons, who are the parties to the arbitration agreement and the substantive contract underlining the agreement. However, only in certain circumstances, a non-signatory should be subjected to arbitration, without prior consent, but it would be an exceptional case. However, by the subsequent decision in the case of Cox and Kings Ltd. (supra), it was clarified that principle of piercing the corporate veil cannot be the sole basis for impleading a non-signatory under the Group of Companies Doctrine and it would require more, such as the common intention of the parties to participate in the transaction.

In any case, if the high burden to subject a non-signatory to arbitration has been met, the consequence would be that the non-signatory participates in the arbitration and has the opportunity to present its case.
",,,"Another submission of Respondent No.1, which deserve appreciation is, the Petitioner was always aware of the scheme of demerger and this is sought to be established on the basis of its own annual reports filed before the Securities Exchange Commission, USA for the year 2006-2007 and 2007-2008, which refer to the pendency of arbitration proceedings, the declaratory Award and that the partial quantification and costs were never treated as Assets or Receivables in the Petitioners Book, but they were only reflected as 'contingencies', making it clear that the Petitioner never 135/168 CARBP-414-18.odt treated the Respondent as a Debtor and the amounts which were to be received were contingent on the conclusion of the disputes interse. The Petitioner itself has produced the scheme of arrangement with the Petition, but it is a draft scheme of de-merger and not the scheme which was finally approved.","Statutes of limitation are sometimes described as ""statutes of peace"", as laws of limitation, founded on public 76/168 CARBP-414-18.odt policy, contemplate that an unlimited and perpetual threat of limitation creates insecurity and uncertainty; and some kind of limitation is essential for public order. The object of fixing time limit for litigation is based on public policy, fixing a lifespan for legal remedy, to be availed for the purpose of general welfare, intended to see that the parties do not resort to dilatory tactics, but avail the legal remedies available, within the prescribed time frame.",,The first scheme of arrangement (the Diversion Scheme) between Respondent No.1 and Respondent No.2 is dated 20/6/2007 when some assets are alleged to have transferred hands in consideration of the shares being transferred to Respondent No.4 and Respondent No.2.
,,,30. It is the specific stand of Respondent No.4 that is not a party to the arbitral proceedings and its impleadment in the Petition is only founded on the claim of IMAX in paragraph 41 of the Petition.,"IMAX supported its claim with the following pleading :-

""36Accordingly, had E-City fully performed its rental obligations under the Master Agreement, IMAX would have realised at least $21,222,920 in revenue over the 20 year term of the leases called for under the Master Agreement, obligations which would, by now, have 45/168 CARBP-414-18.odt been largely performed. E-city should be directed to make payment of this amount to IMAX in order to make IMAX fully whole for its breach of its obligations. In contract, IMAX fully performed and complied with its exclusivity obligations.""",,,"Respondent No.4 face the accusation that as the holding Company of Respondent Nos.1, 2 and 3, it has arranged for the improper diversion of Respondent No.1 to Respondent Nos.2 and 3.","74. The issue of limitation goes to the root of a matter and if it is the duty of a court of law to ensure that the proceedings are filed within the prescribed period of limitation, and a Court or an adjudicating authority may not exercise its jurisdiction, if the proceedings are not filed within limitation and shall refrain itself from deciding it on merit, unless the delay is condoned and the proceedings are brought within the period of limitation, it also becomes an issue of jurisdiction.



32 (2008) 14 SCC 445





                                      78/168                     CARBP-414-18.odt",,"It is the accusation against Respondent No.1 that under the scheme, assets of Respondent No.1 of Rs.92 crores (i.e. assets with book value of Rs.75 crores and current assets of Rs.17.07 crores) were transferred to Respondent No.2 in consideration of its allotting shares to the shareholders of E- City Entertainment."
,,,"31. My attention is also invited to some more pleadings, which I will be reproducing when the rival contentions are dealt with. However, at present, I must record the submission of Mr.Jagtiani, who has invited my attention to Chamber Summons No.100 of 2019, seeking deletion of Respondent No.4, which received a reply from the Petitioner, reiterating that all the Respondents are part of Essel Group of Companies and they have conspired to fraudulently transfer the assets of Respondent No.1 to Respondent Nos. 2 to 4 during the pendency of the arbitration proceedings and all the Respondents should be treated as single entities.","37. E-City, which was the only Respondent before the Arbitral Tribunal, in its Statement of Defence, defended its stand by pleading as below :-

""(a) not a legally binding contract as it was not formed with any intention to create binding legal relations and was therefore not enforceable in law or equity by the Claimant against the respondent;
(b) was an illusory contract that did not give rise to any enforceable legal obligations; and/or
(c) was void for uncertainty.""",,,"132. The declaration sought in the Arbitration Petition in favour of the petitioner to the effect that the three awards passed by the Arbitral Tribunal are enforceable under Part II of the Act of 1996, and the further direction to enforce and execute them as decree in favour of the petitioner and against all the respondents. Similarly, the relief of deposit of the decretal amounts is also sought against the Respondent Nos.1 to 4, but since Mr.Chinoy has offered a clarity that the petitioner seek recognition only against E-City Entertainment, but since it, with an intention to defeat the awards, it has divested its assets to Respondent Nos.2 and 3, they are impleaded in the proceedings.","78. Though Mr.Chinoy has attempted to submit that the issue of limitation is foreclosed and the order dated 13/11/2019 operates as res judicata and in any event, it is 82/168 CARBP-414-18.odt wiped from existence, when the order of 13/11/2019 is carefully perused, it is evident that the focus of the decision is upon Article 136 of the Schedule to the Limitation Act, 1963, by holding that the Petition is not barred by law of limitation, as the award by a foreign court amounts to a decree and is, therefore, covered under Article 136.",,"The second scheme of arrangement (Diversion) between Respondent Nos.1 and 3 is dated 31/8/2007 and it is alleged that immovable properties and assets of Respondent No.1 valued at Rs.119.80 crores were transferred to Respondent No.3 in consideration of it allotting shares to the shareholder of Respondent No.1, i.e. E-City Investment and Holding Co. Ltd., the Respondent No.4 and E-City Real Estate Pvt.Ltd i.e. 141/168 CARBP-414-18.odt Respondent No.2. Even this scheme received sanction on 31/8/2000."
,,,"POINTS FALLING FOR CONSIDERATION IN THE WAKE OF THE RIVAL CONTENTIONS ADVANCED :-
","41. This was followed by the final award dated 27/3/2008, with the following directions:-

""(i) that the respondent do pay to the Claimant the sum of US$ 1,118,558.54 by way of interest upto and including 30th September, 2007;
(ii) that the respondent do pay to the Claimant interest at a rate of US$ 2,512.60 per day from 1st October, 2007 until payment of the Award of US$ 9,406,148.31
(iii) that the respondent do pay to the Claimant costs by way of attorneys' fees, expert fees and related expenses in the sum of US$ 384,789.21.
(iv) that the respondent do pay to the claimant the said sum of US$ 400,000 fixed by the ICC as the costs of the arbitration.""",,,"The Additional Respondents not being parties to the foreign arbitration proceedings and/or the Foreign Award, the Chamber Summons appears to evade this provision. The Additional Respondents have not been given an opportunity to show cause as to why the Foreign Award should not be enforced against them, as they were not parties as envisaged under Section 48 of the said Act. The Foreign Award was enforceable only against the Judgment Debtor who was the party to the arbitration agreement and against whom the Foreign Award was passed. The Foreign Award cannot be enforced against the Additional Respondents who are neither parties to the arbitration agreement nor to the Award.","Paragraph 20 of the decision clearly record that, ""it is well settled that a foreign award is stamped as a decree and hence, as a decree it can be enforced and be executable in one and the same proceeding. In that event Article 136 of the Limitation Act would surely become applicable prescribing a limitation of twelve years from the date when award becomes enforceable and/or the award directing payment of money as specifically provided, under Article 136.""",,"Mr.Chinoy insisted in recording his submission that under the two schemes of demerger, the Respondent No.1 divested and stripped itself virtually all of its assets and improperly divested its properties having a book value of Rs.170 crores and other current assets valued at Rs.38.5 crores to Respondent Nos.2 and 3, and after this transfer, it is left only with assets worth US$ 769,287."
,,,"This award was made in London, the juridical seat of arbitration on 24/8/2003.","42. IMAX Corporation filed application under Rule 14.05 of the Rules of Civil Procedure and Article 35 of the Schedule to the International Commercial Arbitration Act before the Ontario Superior Court of Justice and by order dated 29/11/2011, the Court in Ontario recognized the final award of 27/3/2008 and the partial final award of ICC on jurisdiction 49/168 CARBP-414-18.odt and quantum of 24/8/2007 in the matter of IMAX Limited Vs. E-City Entertainment (L) Pvt. Ltd and declared it to be an enforceable judgment of the Court with full force in effect.

Pursuant thereto, IMAX Corporation sought to domesticate the judgment which it obtained against E-City Entertainment Pvt Ltd from the Superior Court of Justice, Ontario Canada, Essel Group, Subhash Chandra, Atul Goel, Amit Goenka, Laxmi Goel, Zee TV USA, Asia TV USA Ltd and Natural Wellness USA, INC. (collectively, the respondents).

In addition, IMAX sought a turnover order directing the respondents to deliver sufficient funds to justify the judgment or to deliver their personal property to the Sheriff of the country of New York to satisfy the judgment pursuant to the CPLR 5225(b). The Supreme Court of State of New York, County of New York by its decision dated 9/10/2015, however, denied the prayer of IMAX, to the effect that the judgment be recognized against the respondents by treating them as alter- ego or as a single personality as E-City. Recording that IMAX have failed to show that the respondents have one and the same entity as E-City, its request for an order to domesticate the Canadian judgment was denied.

Reference to the relevant observations would be considered at the relevant time when this issue about alter ego is considered by me.",,,"147. Mr.Jagtiani has submitted that the reference to the discussion of the law and the manner of its application to the 154/168 CARBP-414-18.odt facts, in Crown Prosecution Services Vs. G.46 is apposite, where the UK High Court of Justice was dealing with an application which required it to determine whether the assets of two companies- Prolink and Powervale- could be treated as the assets of one of its shareholders and directors, Mr.G., by piercing the corporate veil.","Since the period consumed from the day of passing of the last award on 27/03/2008, despite filing of petition under Section 34 of the Act of 1996 in India and since it did not amount to an automatic stay on the enforcement/ execution of 89/168 CARBP-414-18.odt the award, it was open to the petitioner to file the enforcement petition within time period of 3 years from the expiry of 28 days from each of the award, as under the English Arbitration Act, 1996, time period to challenge the award is 28 days, and the time to enforce the award began to run on expiry of 28 days from passing of the awards.",,"Whilst what occurred no doubt enabled G to invest what appear to be part of his ill-gotten gains. I am not persuaded that on the evidence an arguable case is demonstrated to show that G was attempting to hide behind the corporate veil so as to conceal his crime and his benefits from it..."""
,,,"43. E-City, the Respondent No.1 has contested the petition on four counts:-

""(a) The present Petition has been filed beyond the limitation period.
                                 50/168                    CARBP-414-18.odt

  (b)    In the scheme of Part II of the Arbitration and Conciliation
Act, Sections 47 to 49 do not contemplate exectuion proceedings under Order XXI of the Code of Civil Procedure, 1908 and the Petitioner has already filed a separate application for execution only against Respondent No.1, which is pending.","43. E-City, the Respondent No.1 has contested the petition on four counts:-

""(a) The present Petition has been filed beyond the limitation period.
                                 50/168                    CARBP-414-18.odt

  (b)    In the scheme of Part II of the Arbitration and Conciliation
Act, Sections 47 to 49 do not contemplate exectuion proceedings under Order XXI of the Code of Civil Procedure, 1908 and the Petitioner has already filed a separate application for execution only against Respondent No.1, which is pending.
The present Petition, which seek relief in the nature of execution, is untenable.

c) The present Petition is in essence a Petition challenging the demerger scheme which is not permissible;

(d) The invocation of Arbitration was invalid under the laws of Singapore i.e. Seat of Arbitration.

(e) Enforcement of the said Foreign Award would be contrary to the public policy of India as per Section 48(2)(b) of the Arbitration and Conciliation Act, 1996.""",,,"149. Though the claim in the Petition is about the purported fraud engaged by Respondent No.4, the pleading to that effect is merely vague, as it is asserted that the respondents have conspired to fraudulently transfer the asset of Respondent No.1 to Respondent Nos.2 to 4 during the pendency of the arbitration, but except the bare statement, there is no material to demonstrate the alleged fraud, as merely alleging fraud is not sufficient as fraud has to be established by cogent evidence.","50. In the field of private international law, courts refuse to apply a rule of foreign law or recognise a foreign judgment or a foreign arbitral award if it is found that the same is contrary to the public policy of the country in which it is sought to be invoked or enforced. The English courts follow the following principles:

""Exceptionally, the English court will not enforce or recognise a right conferred or a duty imposed by a foreign law where, on the facts of the particular case, enforcement or, as the case may be, 91/168 CARBP-414-18.odt recognition, would be contrary to a fundamental policy of English law. The court has, therefore, refused in certain cases to apply foreign law where to do so would in the particular circumstances be contrary to the interests of the United Kingdom or contrary to justice or morality."" (See: Halsbury's Laws of England, 4th Edn., Vol. 8, para 418.)""",,"The common thread, which according to the Petitioner, connect all the Respondents are Mr.Atul Goel, Ms.Laxmi Goel, Ms.Chandra Goel, Mr.Arpit Goel, Ms.Charu Goel and Mr.Ankit Goel, the eventual shareholders of Respondent No.4, who are the eventual holder of Respondent Nos.1 to 3. Therefore, to show that Respondent No.4 and Respondent No.1 are alter 160/168 CARBP-414-18.odt egos of one another, it would have been necessary to implead the shareholders of Respondent No.4 and plead specific facts about actions taken by these shareholders. Not only is the Petition entirely devoid of any such pleadings, but the shareholders of Respondent No.4 have not even been impleaded."
,,,"The present Petition, which seek relief in the nature of execution, is untenable.
","ANALYSIS OF THE COUNTER SUBMISSIONS ADVANCED WITH REFERENCE TO THE ISSUES THAT FALL FOR CONSIDERATION :-

ISSUE NO. A Whether a common petition filed by the Petitioner seeking recognition/enforcement and execution can be entertained.",,,"150. Since the Respondent Nos.2 to 4 who are not signatory to the arbitration agreement are sought to be roped into the present proceedings, which is the post arbitration stage, the burden of establishing the necessity to implead them as parties, is on the petitioner and it is an onerous burden, as they are the parties being proceeded in execution and never had the opportunity to make out a case before the Arbitral Tribunal. They had no opportunity to plead/contradict the pleadings, lead evidence, advance arguments, and therefore, impleading them at this stage, on a broad premise that they have participated in the fraud, so as to divest the Respondent No.1, a party to the award, of its assets, with an intention to avoid its liability under the awards, is very difficult proposition to be accepted.","Imax would provide services such as maintenance, digital services, delivery and installation and marketing and programming for amount as fees and charges etc.""",,"The award quoted Mr.Lenczner QC's opinion on 30/08/2006 to the following effect:-

""Imax Limited was first incorporated in Ontario on December 14,1998. It paid the statutorily required incorporation fees, filed annual returns, and carried on business in Ontario following its inception. Imax Limited was regulated by Ontario's Minister of Consumer and Business services, and was governed by various Ontario statutes including the OBCA, the Corporations Information Act, and the regulations promulgated thereunder. In March 1999, Imax Limited changed its name to ""Imax Ltd."" In December 2000, Imax Ltd. left the jurisdiction of Ontario and continued itself as a federal corporation named ""3850391 Canada Inc."". A certificate of continuance was issued pursuant to s.187 of the CBCA [Canadian Business Corporation Act].
On January 1, 2001, 3850391 Canada Inc. amalgamated with Imax Corporation, another already existing dual corporation, pursuant to s. 181 of the CBCA.
I have conducted a corporate search and learned that a further amalgamation took place on January 1, 2002 resulting in a successor entity with the same name, ""Imax Corporation""
162/168 CARBP-414-18.odt On June 16, 2004, Imax Ltd. commenced ICC arbitration proceedings in its own name against E-City. This was done despite the fact that it commenced on January 23, 2004 a separate but related arbitration proceeding in the name of ""Imax Corporation"".
..."
