,,,,"99. In the light of principle objective of New York Convention, being to ensure enforcement of Awards, notwithstanding that the Awards are not rendered in conformity to the national laws, the Delhi High Court held that that ""the objections to enforcement on the ground of public policy must be such that it offend the core values of a member state's national policy which it cannot be expected to compromise"". The Delhi High Court, inter alia, relied on the Judgment of Bombay High Court in POL India Projects Limited vs. Aurelia Reederei Eugen Friederich GmbH Schiffahrtsgesellschaft & Company KG 38, which held that the contention that violation of FEMA was to be treated as equivalent to the earlier violation of FERA was not correct and the conclusion was supported by the following observation :

""104. With the liberalization of our economy, it was felt that FERA must be repealed and new legislation must be enacted. The Statement of Objects and Reasons of FEMA indicate that FEMA was enacted in view of significant developments that had taken place since 1993: there was substantial increase in the foreign exchange reserves, growth in foreign trade, rationalisation of tariffs, current account convertibility, liberalisation of Indian Investments abroad, increased access to external commercial borrowings by Indian corporates and participation of foreign institutional investors in our stock markets. There was a paradigm shift in the statutory policy. The focus had now shifted from prohibiting transactions to a more permissible environment. The fundamental policy of FEMA no longer proscribes or prohibits Indian entities from expanding their business overseas and accepting risks in relation to transactions carried out outside India. And, as the title of FEMA suggests, the policy now is to manage foreign exchange. Under FEMA, all foreign account transactions are permissible subject to any reasonable restriction which the Government may impose in consultation with the RBI. It is now permissible to not only compound irregularities but also seek ex post facto permission. Thus, the question of declining enforcement of a foreign award on the ground of any regulatory compliance or violation of a provision of FEMA would not be warranted.""
The Bombay High Court in case of POL India (supra) had held that even if a permission was required to be taken before execution of Letter of Guarantee , without its compliance, the execution of Letter of Guarantee would not be contrary to fundamental policy of Indian Law and the reasoning adopted was somehow similar when the Court observed thus :

""108. Having held that a simpliciter violation of any particular provision of FEMA cannot be considered synonymous to offending 38(2015) SCC OnLine Bom 1109 105/168 CARBP-414-18.odt the fundamental policy of Indian law, it would also be apposite to mention that enforcement of a foreign award will invariably involve considerations relating to exchange control. The remittance of foreign exchange in favour of a foreign party seeking enforcement of a foreign award may require permissions from the Reserve Bank of India. There may also be a question whether the initial agreement pursuant to which a foreign award has been rendered required any express permission from RBI. However, as indicated earlier, the policy under FEMA is to permit all transactions albeit subject to reasonable restrictions in the interest of conserving and managing foreign exchange. India has not accepted full capital account convertibility as yet. Thus, there are transactions for which permission may not be forthcoming. Whereas certain transactions are permitted under FEMA and regulations made thereunder without any further permissions; other transactions may require express permission from the RBI. However, these considerations can be addressed by ensuring that no funds are remitted outside the country in enforcement of a foreign award, without the necessary permissions from the Reserve Bank of India. This would adequately address the issue of public interest and the concerns relating to foreign exchange management, which FEMA seeks to address.
109 .........
110. The contention that enforcement of the Award against Unitech must be refused on the ground that it violates any one or the other provision of FEMA, cannot be accepted; but, any remittance of the money recovered from Unitech in enforcement of the Award would necessarily require compliance of regulatory provisions and/or permissions.""
100. The fundamental policy of Indian Law is a concept narrower than the policy of Indian Law, which means that a mere",,,,,,
,,,,"100. The fundamental policy of Indian Law is a concept narrower than the policy of Indian Law, which means that a mere violation of law is not enough to make an award vulnerable.

The Explanation (1) appended to Section 48 itself provides guidance by clarifying that the Award is in conflict with public policy in India if it is in contravention with the fundamental policy of Indian Law or is in conflict with the basic notions of morality or justice.",,,,,,
,,,,"101. One of the constituents of public policy of India                 is the
expression ""fundamental policy of Indian law"" .               Akin to the
explanation (2) of Section 34(2) of the Act of 1996, Section 48 (2) offers a clarification that whether there is contravention with the fundamental policy of Indian Law, it shall not entail a review on merits of the dispute.

In Renusagar Power Co. Ltd. (supra), it was held that violation of Foreign Exchange Regulation Act , 1973, being a statute enacted to safeguard the national economic interest, shall be contrary to the public policy of India and the fundamental policy of Indian law.

A decade later in ONGC Vs. Saw Pipes Ltd.39, after examining the grounds on which the Award can be set aside under Section 34 of the Act, the Apex Court held that in addition to the narrower meaning given to the term ""public policy"" in Renusagar (supra) , the Award can be set aside, if it was patently illegal.

Although the Apex Court in ONGC Vs. Saw Pipes Ltd. (supra) sought to expand the scope of enquiry to set aside an Award in purely domestic arbitrations by giving a wider interpretation to term 'public policy', it had the effect of being extended to apply equally to Award arising out of International Commercial Arbitration as well as foreign awards, given the language, employed in the statute.",,,,,,
,,,,"The Law Commission further recommended restriction of the scope of 'public policy' to bring the definition in line with the one propounded in Renusagar (supra) .

Before the recommendations could be implemented, the term 'fundamental policy of Indian law' was construed widely by the Apex Court in ONGC Vs. Western GECO International Ltd.40, to include Wednesbury principle of reasonableness when the Apex Court without exhaustively enumerating the purport of the expression 'fundamental policy of Indian law' referred to the three drastic principles which would be understood to be a part and parcel of fundamental policy of Indian law, which included, adopting a judicial approach, following principles of natural justice and absence of perversity or irregularity tested on the touchstone of Wednesbury principles of reasonableness.

The Apex Court, thus incorporated the Wednesbury principle of reasonableness as a part of fundamental policy of Indian Law .",,,,,,
,,,,"103. In Associate Builders Vs. DDA41 the Apex Court further fortified this concept of fundamental policy of Indian Law to include - violation of FERA and disregard to the orders of the superior Courts and the three juristic principles as expounded in Western GECO, the principles not being exhaustive, but capable of further expansion. Since the Law commission was of the view that the clarification was needed to ensure that the term 'fundamental policy of Indian law"" is narrowly construed and if such clarification is not provided all 40 (2014) 9 SCC 263 41 (2015) 3 SCC 49 108/168 CARBP-414-18.odt amendments suggested by it, in relation to the term ""public policy"" and ""fundamental policy of Indian Law"" will be rendered negatory which would permit review of an Arbitral Award on merits, and would be opening for challenges on this ground, the suggestion made by the Law Commission were adopted and the Act was amended with effect from 23/10/2015.

In Ssangyong Engg. & Construction Co. Ltd. (supra) the Apex Court embarked on the journey of tracing amendments in the backdrop of the statement of object of the 2015 Amendment and it was held that that the expression 'fundamental policy of Indian Law', would be relegated to Renusagar (supra) understanding i.e. violation of provisions of FERA and disregard to the Judgments of of superior of Court.",,,,,,
,,,,"104. The Delhi High Court in Cruz (supra) elaborated the expression "" fundamental policy"" by declaring that the objections on the ground of public policy must be such that it offend the core values of Indian National Policy, and those cannot be expected to be compromised.",,,,,,
,,,,"105. This decision of Delhi High Court received approval from the Apex Court in Vijay Karia (supra) by adding that, ""fundamental policy refers to the core values of India's public policy as a Nation, which may find expression not only in statute, but also time honored, hallowed principles, which are followed by the Courts"".",,,,,,
,,,,"106. In Vijay Karia (supra), the Apex Court reaffirmed the principle that for violation of fundamental policy of Indian Law, there shall be a breach of legal principle of legislation that is so basic to Indian Law that the same cannot be compromised and mere violation of any enactment shall not be a breach of fundamental policy of Indian Law and while expounding this proposition, the Apex Court created a narrow opening to include not only legislation/ enactments that can be said to be integral part of the policy of India, but also time honored hallowed principles which are consistently followed by the Courts in India.

The time honored hallowed principles forming core value of national policy, may cover an Award which is passed in disregard to the orders passed by the superior Court or passing an Award on the basis of the void contract or upholding the transaction rendered void by a Statute, as these may be some of the illustrations of the legal principles, which are incapable of being compromised, and in any case, the list may not be exhaustive.",,,,,,
,,,,"107. A contingent contract, which was capable of being performed in case the Government give the requisite 110/168 CARBP-414-18.odt authorisation and which was in contemplation at the time of entering into the contract, and when an arbitration award was passed, without such permission being granted by the Government, in National Agricultural Co-Operative Marketing Federation of India (supra), the award was held to be ex-facie illegal and in contravention of the fundamental law, since no export without permission of the Government was permissible and without the consent of the Government, the quota could not have been forwarded. In this background, the export without permission was in violation of the law and it was conclusively held that enforcement of such award would be violative of the public policy of India.",,,,,,
,,,,"NAFED, by relying upon clause 14 of the agreement, adopted a stand that on happening of the contingency agreed 111/168 CARBP-414-18.odt to by the parties, the contract was rendered unenforceable under Section 32 of the Contract Act and as such, it could not be held liable to pay damages under foreign award.",,,,,,
,,,,"While deriving its conclusion, reliance was placed upon Section 32 of the Contract Act and I must gainfully reproduce the relevant observations.

""44. In the present case, parties have agreed, and in Clause 14 of the Agreement, it was contemplated that during the contract if there is any prohibition of the export or any other executive or legislative Act by or on behalf the Government of the Country of origin, the unfulfilled part of the contract shall be cancelled. Because of the refusal by the Government, it was not permissible to NAFED to make a supply to the Alimenta S.A. Hence, the unfulfilled part was required to be cancelled. Thus, NAFED was justified in not making the supply as it would have violated the Export Control Order, and it was not permissible to carry forward the quantity of the previous year to the next year because of the Export Control Order without permission of the Government.
45. It is apparent that the contract came to an end in terms of Clause 14 of the Agreement. The contract became void in view of the provisions contained in Section 32 of the Indian Contract Act, 1881 (for short, ""the Contract Act""). The stipulation in Clause 14 releases both parties from the performance of the contract.
46. ... ... ...
47. ... ... ...
48. Section 32 of the Contract Act applies in case the agreement itself provides for contingencies upon happening of which contract cannot be carried out and provide the consequences. To this case, provisions of Section 32 of the Contract Act is attracted and not Section 56. In case an act becomes impossible at a future date, and that exigency is not provided in the agreement on the happening of which exigency, impossible or unlawful, the promisor had no control 112/168 CARBP-414-18.odt which he could not have prevented, the contract becomes void as provided in Section 56.......
49. In the present case, because of the clear stipulation in Clause 14 of the Agreement, it is apparent that the parties have agreed for a contingent contract. They knew very well that the Government's executive, or legislative actions might come in the way as provided in Clause 14 of the Agreement. Thus, in this case, Section 32 of the Contract Act is attracted and not the provisions of section 56. It was an agreement to do an act impossible in itself without permission, and that is declared to be void by Section 32. The contract was capable of being performed in case the Government gave the requisite authorisation. It is not an event that was not in contemplation at the time of entering into the agreement. Government permission was necessary. Section 56 is not attracted as the promisor and promisee both knew the reason in advance as in agreement such a contingency was provided itself in case of Government's executive order comes in the way, for cancellation of the contract. Thus, the contract became void on the happening of the contingency, as provided in Section 32 of the Contract Act.""",,,,,,
,,,,"In conclusion, the Apex Court held thus :-

""58. It would have been unlawful for NAFED to affect the supply in view of the Government's refusal to accord the permission, and both the parties knew it very well and agreed that the contract would be cancelled in such an exigency for no-supply in quantity. Thus, they were bound by the agreement. The award pre- supposes supply could have been made after the Government's refusal. If supply had been made, it would have been unlawful. Thus, the parties agreed for its cancellation as such an award is against the basic law and public policy as applied in India.
59. It is also apparent that the Government rightly objected to the supply being made at the rate of the previous season in the next season, particularly when the prices escalated thrice. The addendum was entered into subsequently, unfairly, and the parties fully understood that the Government would not permit export at the rate on which supply was proposed, and NAFED was acting only as a canalising agent of the Government of India. Thus, for such an unfair contract, permission was rightly declined by the Government. In the previous year, the commodity could not be supplied due to force majeure. In no event, supply could have been made in December 1980 and January 1981 sans permission from the Government of India.""
108. Answering the question as to whether award can be contrary to the public policy, with reference to Section 23 of the Contract Act, which prescribed as to what consideration 113/168 CARBP-414-18.odt and objects are lawful and what are not, it was noted that the consideration or object of an agreement is unlawful, if the Court regard it as immoral or against the public policy and it would be void. On an exact exhaustive reproduction of the observations in Renusagar Power Co. Ltd. (supra), Ssangyong Engg. & Construction Co. Ltd. (supra) as well as Western GECO (supra), in the wake of clause 14 of the agreement and as per the law applicable in India, it was concluded that no export could have taken place without the permission of the Government and the appellant-NAFED was unable to supply in absence of these permissions. This was held to be a matter pertaining to fundamental policy of India and the conclusion of the Apex Court was worded explicitly as below :-

""69. It is apparent from abovementioned decisions as to enforceability of foreign awards, Clause 14 of FOSFA Agreement and as per the law applicable in India, no export could have taken place without the permission of the Government, and NAFED was unable to supply, as it did not have any permission in the season 1980-1981 to effect the supply, it required the permission of the Government. The matter is such which pertains to the fundamental policy of India and parties were aware of it, and contracted that in such an exigency as provided in clause 14, the Agreement shall be cancelled for the supply which could not be made. It became void under Section 32 of the Contract Act on happening of contingency. Thus, it was not open because of the clear terms of the Arbitration Agreement to saddle the liability upon NAFED to pay damages as the contract became void. There was no permission to export commodity of the previous year in the next season, and then the Government declined permission to NAFED to supply. Thus, it would be against the fundamental public policy of India to enforce such an award, any supply made then would contravene the public policy of India relating to export for which permission of the Government of India was necessary.
70. In our considered opinion, the award could not be said to be enforceable, given the provisions contained in Section 7(1)(b)(ii) of the Foreign Awards Act. As per the test laid down in Renusagar, its enforcement would be against the fundamental policy of Indian Law and the basic concept of justice. Thus, we hold that award is unenforceable, and the High Court erred in law in holding otherwise in a perfunctory manner.""
114/168 CARBP-414-18.odt In the result, the appeal filed by NAFED was allowed and the award was held to be unenforceable.",,,,,,
,,,,"Once again, on 15/12/2000, E-City expressed its urgency seeking its approval for acquiring on credit, the System 1 and take delivery of the system in Canada/U.S.A. and to pay the consideration in installment, so that it can execute necessary agreement with IMAX..

Here, E-City was struck as until it received permission from RBI, the proposed transaction would not have been a lawful contract within the meaning of Section 10 read with Section 23 of the Contract Act, 1872 and this resulted in IMAX issuing notice of termination of exclusivity to E-City by asserting that they were at liberty to pursue sale and/or lease of IMAX systems and opening of IMAX theaters around India. On 17/05/2004, IMAX issued a notice of default, in pursuance of the Master Agreement by citing time as its essence. Clarifying that if E-City fails to make arrangements acceptable to IMAX within 20 days, it threatened to enforce its right pursuant to the Master Agreement, including commencement of arbitration proceedings.",,,,,,
,,,,"110. Yet another exposition of law on this subject by the Apex Court is in the case of Asha John Divianathan (supra), which has reiterated that a contract is void, if it is prohibited by a statute imposing penalty, even without expressed declaration that the contract is void and this was in reference to Section 31 of the FERA, to be read with other provisions in the Act, contemplating obtaining of previous permission of RBI, which was held to operate in the nature of prohibition. Holding that a transfer/transaction in contravention of requirement of previous permission of RBI under Section 31 of FERA is void, it is held that no ex post facto permission can be granted by RBI under Section 31.

Asha John Divianathan (supra) relied upon Vijay Karia (supra), while it concluded that the requirement of seeking general or special permission of RBI in respect of transaction covered by Section 31 of the FERA is mandatory and in a transaction of sale or gift of the property situated in India by a foreigner in contravention thereof would be unenforceable in law.",,,,,,
,,,,"In the appeal before the Apex Court, the appellant-Asha John urged that the gift deeds are null and void and not binding upon her, as they are unenforceable in light of mandate of Section 31 of the Act of 1973. In support of the submission, reliance was placed upon the decision in the case of Renusagar Power CO. Ltd. (supra ) and Vijay Karia (supra).",,,,,,
,,,,"Focusing upon the avowed object of Section 31, being to minimise the drainage of foreign exchange by way of repatriation of income from immovable property and sale proceeds in case of disposal of property by a person, who is not a citizen of India, its purpose was highlighted being to put restrictions on acquisition, holding and disposal of immovable property in India by foreigners/non-citizens.

In paragraphs 19 and 20, the scope of this Section was clearly summarized in the following words :-

""19. On a bare reading of Section 31(1), it is crystal clear that a person, who is not a citizen of India, is not competent to dispose of by sale or gift, as in this case, any immovable property situated in India without previous general or special permission of RBI. The only exception provided in the proviso is that of acquisition or transfer of immovable property by way of lease for a period not exceeding five years. This provision applies to foreign citizens and foreign and FERA companies only. A non-resident Indian Citizen is not covered thereunder......
20. In other words, a person, who is not a citizen of India, holding immovable property situated in India was obliged to make disclosure and declaration in that behalf of RBI; and in any case, if he/she intended to dispose of such property by sale, mortgage, lease, gift, settlement or otherwise, was expected to obtain previous general or special permission from RBI. Only the, transfer so intended could be given effect to. It is true that the consequences of failure to seek such previous permission have not been explicitly specified in the same provision or elsewhere in the Act, but then the purport of Section 31 must be understood in the context of intent with which it has been enacted, the general policy not to allow foreign investment in landed property/buildings constructed by foreigners or to allow them to enter into real estate business to eschew capital repatriation, including the purport of other provisions of the Act, such as Sections 47, 50 and 63.""",,,,,,
,,,,"111. The soul of the decision lies in its observation in paragraph 26, which read as under :-
""26. It is well established that a contract is void if prohibited by a statute under a penalty, even without express declaration that the contract is void, because such a penalty implies a prohibition. Further, it is settled that prohibition and negative words can rarely be directory. In the present dispensation provided under Section 31 of the 1973 Act read with Sections 47, 50 and 63 of the same Act, although it may be a case of seeking previous permission it is in the nature of prohibition as observed by a three-Judge Bench of this Court in Mannalal Khetan v. Kedar Nath Khetan. In every case where a statute imposes a penalty for doing an act, though, the act not prohibited, yet the thing is unlawful because it is not intended that a statute would impose a penalty for a lawful act. When penalty is imposed by statute for the purpose of preventing something from being done on some ground of public policy, the thing prohibited, if done, will be treated as void, even though the penalty if imposed is not enforceable....""",,,,,,
,,,,"112. From the analysis of Section 31 of the Act and upon conjoint reading of Sections 47, 50 and 63 on facts, it was concluded thus :-

""32. ...we must hold that the requirement of taking ""previous""
permission of RBI before executing the sale deed or gift deed is the quintessence; and failure to do so must render the transfer unenforceable in law. The dispensation under Section 31 mandates ""previous"" or ""prior"" permission of RBI before the transfer takes effect. For, RBI is competent to refuse to grant permission in a given case. The sale or gift could be given effect and taken forward only after such permission is accorded by RBI. There is no possibility of ex post facto permission being granted by RBI u nder Section 31 of the 1973 Act, unlike in the case of Section 29 as noted in LIC. Before grant of such permission, if the sale deed or gift deed is challenged by a person affected by the same directly or indirectly and the court declares it to be invalid, despite the document being registered, no clear title would pass on to the recipient or beneficiary under such deed. The clear title would pass on and the deed can be given effect to only if permission is accorded by RBI under Section 31 of the 1973 Act to such transaction.""",,,,,,
