,,,"120. This issue of requiring mandatory approval of Reserve Bank of India, is actually determined by me as the bone of contention between the Parties, since the objection to the enforceability of the Awards is raised on the ground that the Awards are passed in contravention to the fundamental policy in India and here the FEMA Act and Regulations/Circulars under the said Act. The Arbitral Tribunal ought to have focused upon the specific stand raised by E-City in its statement of defence qua the requirement of mandatory 125/168 CARBP-414-18.odt approval of Reserve Bank of India, but unfortunately this was dealt with in a routine manner without focusing upon the same in depth. The Arbitral Tribunal has failed to consider the prime issue whether the Agreement in question is forbidden by law based upon the principal of private International Law viz. a contractual obligation which can be invalidated by Exchange Control Registration if it part of the law in the place of its performance.","62. In this background, the short question which fell for consideration, as to whether the Petition was filed within the prescribed limitation, came to be decided and while the learned Single Judge clearly accepted that the enforcement and execution can form part of the same proceedings and, therefore, found it appropriate to invoke Article 136 under the Limitation Act and concluded thus :-
""26. It is thus beyond a pale of doubt that enforcement and execution can form part of the same proceedings. If this be so then certainly Article 136 under the Limitation Act becomes relevant. If the argument of non applicability of Article 136 as urged on behalf of the respondent is accepted, it would be contrary to the principle of law as laid down by the Supreme Court in Fuerst Day Lawson Ltd. Vs. Jindal Exports Ltd. (supra) apart from deeply damaging the decreetal interest of the award creditors apart from being contrary to the object of Section 47 to 49 of the Arbitration Act.
27. In fact the above legal position now stands reinforced as seen from a recent decision of the Supreme Court in M/S.Shriram EPC Ltd. Vs. Rioglass Solar SA, the Supreme Court taking note of the decisions in Fuerst Day Lawson Ltd. Vs. Jindal Exports Ltd. (supra) and Thyssen Stahlunion GMBH Vs. Steel Authority of India Ltd. (supra) has held that the observations of the Supreme Court in Fuerst Day Lawson Ltd. Vs. Jindal Exports Ltd. (supra) that ""the only difference as found is that while under the Foreign Awards Act a decree follows, under the new Act the foreign award is already stamped as the decree."" to mean that the expression ""stamped""
means ""regarded"" This means that the foreign award is to be regarded as a decree. The following observations of the Supreme Court in paragraph 19 read thus:-

""One sentence in Fuerst Day Lawson (supra) reads, ""[T]he only difference as found is that while under the Foreign Awards Act a decree follows, under the new Act the foreign award is already stamped as the decree."" This sentence does not lead to the conclusion, following the judgment in Thyssen Stahlunion GMBH Vs. Steel Authority of India Ltd., (1999) 9 SCC 334, that under the 1996 Act, a foreign award is considered to be stamped already. All that this sentence means is that the foreign award is to be regarded as a decree. The expression ""stamped"" means ""regarded"". This judgment also does not carry us much further.""",,,,"This opinion from Mr.Chudasama, a witness competent to depose, went un-controverted, as he was not cross- examined.",,
,,,,"63. Even the Petition was tested by applying the provision of Article 137 and an inference was drawn in the wake of the 69/168 CARBP-414-18.odt documentary evidence with its chronology that the Petition is not barred by law of limitation, by recording as under :-

""28. Now coming to the contention as urged on behalf of the respondents, the main thrust of the respondents' argument is the decision of the learned Single Judge of this Court in Noy Vallesina Engineering Spa v/s. Jindal Drugs Limited (supra). In my opinion considering the facts of the present case and as noted above, that the Supreme Court on 10 March 2017 set aside the order passed by this Court holding that the Section 34 petition filed by the respondents was not maintainable and the present proceedings being filed on 2 April 2018, even by applicability of the provisions of Article 137 of the Limitation Act, the petition is not barred by limitation. In any case, applying the principle of law as laid down in Fuerst Day Lawson Ltd. Vs. Jindal Exports Ltd. (supra) and M/S.Shriram EPC Ltd. Vs. Rioglass Solar SA (supra), the Court cannot overlook the prayers as made by the petitioner which are in the nature of a combined petition namely for enforcement and for execution of the award. As observed above a broader view is required to be taken to advance the object and intention of the provisions of the Arbitration Act and not a hard technical approach as urged by the respondents that the petition be held as time barred, by applying Article 137 of the Limitation Act in the absence of a delay condonation application and the delay being condoned. This contention of the respondents militates against from what the Supreme Court has now further clarified in M/S.Shriram EPC Ltd. Vs. Rioglass Solar SA (supra)that when it was observed in Furest Day Lawson Ltd. Vs. Jindal Exports Ltd (supra) that the Foreign award is already stamped as a decree, it means that ""the foreign award is to be regarded as a decree."" In view of this clear position in law there is no manner of doubt and more particularly as seen the prayers as made in the petition that this petition cannot be held to be time barred, as contended on behalf of the respondents.""",,,,"However, in the award, the Tribunal rejected the argument that the clause concerning RBI rendered the obligations unenforceable, by recording that clause 14 for that matter does not say that the permission of the bank is a condition precedent to the enforcement of the agreement, on the contrary all that clause 14 does, is refer to the obligation of the parties to negotiate a change in the structure, should the RBI not approve it. It is concluded that it was not an escape clause for E-City to avoid any liability, but it was a clause indicating that the parties would restructure their arrangement within the framework of the Master Agreement, if the RBI raise concern.",,
,,,,"64. The order dated 13/11/2019 to the above effect was challenged by IMAX and during its pendency, a three-Judge Bench of the Supreme Court in Vedanta Limited (supra), by taking note of this order passed by the learned Single Judge on 13/11/2019, reached a conclusion that a foreign award was a decree and, therefore, Article 136 of the Limitation Act is applicable for its enforcement.

70/168 CARBP-414-18.odt The issue of limitation for filing an enforcement/ execution application of foreign award under Section 47 of the Act of 1996, was deliberated upon, in the wake of the divergent views being taken by different High Courts with respect to the period of limitation.

In making reference to the various decisions, the decision of the learned Single Judge of Bombay High Court in Noy Vallesina Engg. Spa Vs. Jindal Drugs Ltd. 30, Imax Corporation Vs. E-City Entertainment (India) (P) Ltd. as well as the decisions of the Madras High Court and the Delhi High Court were taken note of.

As regards the view taken in Imax (supra), it was noted that another Single Judge of the Bombay High Court, followed the Judgment in Fuerst Day Lawson Ltd. and held that since the foreign award is already stamped as a decree, the award holder may apply for enforcement, after steps are taken for execution of award under Sections 47 and 48 of the Act of 1996, as in one proceedings, there may be different stages, the first stage being the Court would require to decide on the enforceability of the award, having regard to the requirement of the provision and, thereafter, proceed to take steps for its execution and, therefore, Article 136 would be applicable for enforcement of a foreign award.",,,,"117. Even Mr.David Berman, the witness on behalf of IMAX, gave a clear admission that in respect of additional payments, 123/168 CARBP-414-18.odt it is conceded by RBI to be extraordinary commercial borrowings and if it is so then definitely the FEMA and the restrictions imposed by RBI as well as the Central Government are expected to be complied with, having been held to be mandatory.",,
,,,,"65. Their Lordships of the Apex Court, in the wake of the conflicting pronouncements, noted that the Indian Arbitration Act, 1996 does not specify any period of limitation for filing application for enforcement/execution of foreign award, 30 2006 SCC OnLine Bom 545 71/168 CARBP-414-18.odt though Section 43 provide that the Limitation Act, 1963 shall apply to arbitrations, as it applies to proceedings in Court.

It is recorded that Limitation Act, 1963 does not contain any specific provision for enforcement of a foreign award and Articles 136 and 137 fall within the third division of the Schedule, and Article 136 provides that the period of limitation for the execution of any decree or order of a ""civil court"" is twelve years from the date when the decree or order becomes enforceable.

Article 137 was referred to as residuary provision, prescribing the limitation of three years from the point of time, when the right to apply accrues.",,,,"A party, in an adversary system deserve an opportunity to challenge by cross-examination, the evidence of any witness of the opposing party, so as to impact the witnesses's credibility, so that his evidence shall not be accepted on that point and this is a well recognized matter of fairness in legal proceedings. This opportunity ensure that a witness is given an opportunity to explain his or her evidence, if it is to be impugned. A Party is disentitled to impugn the witness or another parties witness, if he has not asked appropriate question enabling the witness to deal with the same.",,
,,,,,,,,"The Agreement clearly contemplated prior approval of Reserve Bank of India, but the Award proceed on the basis that there is no evidence to prove that Reserve Bank of India would not have given permission, without testing the assertion of E-City that RBI never granted permission. Mr. Chudasma, the witness of E-City has unequivocally stated; ""......... Given by, that the Authorized Dealer State Bank of India itself had sought prior Reserve Bank of India approval for remittance of monies under the LOI and it was not possible for E-City to have made the remittances without prior approval of RBI."" The Tribunal ought to have, therefore, considered the issue by taking into consideration the above statement surfacing from the evidence of Mr. Chudasama which went un-contraverted.",,
,,,,"66. In light of the said scheme, further observations of the Apex Court in paragraph 69 deserve a reproduction :-

""69. Section 36 of the Arbitration Act, 1996 creates a statutory fiction for the limited purpose of enforcement of a ""domestic award"" as a decree of the court, even though it is otherwise an award in an arbitral proceeding. By this deeming fiction, a domestic award is deemed to be a decree of the court, even though it is as such not a decree passed by a civil court. The Arbitral Tribunal cannot be considered to be a ""court"", and the arbitral proceedings are not civil proceedings. The deeming fiction is restricted to treat the award as a decree of the court for the purposes of execution, even though it is, as a matter of fact, only an award in arbitral proceeding. In Paramjeet Singh Patheja V. ICDS Ltd., this Court in the context of a domestic award, held that the fiction is not intended to make an award a decree for all purposes, or under all statutes, whether State or Central. It is a legal fiction which must be limited to the purpose for which it was created. Paras 39 and 42 of the judgment in Paramjeet Singh Patheja read as : (SCC pp.345-46) ""39. Section 15 of the Arbitration Act, 1899 provides for ""enforcing""
the award as if it were a decree. Thus a final award, without actually being followed by a decree (as was later provided by Section 17 of the Arbitration Act of 1940), could be enforced i.e. executed in the same manner as a decree. For this limited purpose of enforcement, the provisions of CPC were made available for realising the money awarded. However, the award remained an award and did not become a decree either as defined in CPC and much less so far the purposes of 72/168 CARBP-414-18.odt an entirely different statute such as the Insolvency Act are concerned.

** ** **

42. The words ""as if"" demonstrate that award and decree or order are two different things. The legal fiction created is for the limited purpose of enforcement as a decree. The fiction is not intended to make it a decree for all purposes under all statutes,whether State or Central.""

(emphasis supplied)",,,,"The question so arose, when Mr. and Mrs. Griffiths and their youngest son went on a package holiday, which included package of meals. Mr. Griffith suffered a serious stomach upset which left him in long term problem and he sued the travel company. At trial, Mr. and Mrs. Griffiths gave uncontested evidence as to the fact. The evidence of an expert was also lead, who expressed an opinion, that on the balance of probabilities the food or drink served at the hotel was the cause for Mr. Griffiths woes.",,
,,,,"67. Further observations leading to a conclusion in paragraph 76 to the effect that the period of limitation for filing a petition for enforcement of a foreign award under Sections 47 and 49 would be governed by Article 137 of the Limitation Act, 1963, is supported by the following reasoning :-

""72. Foreign awards are not decrees of an Indian civil court. By a legal fiction, Section 49 provides that a foreign award, after it is granted recognition and enforcement under Section 48, would be deemed to be a decree of ""that court"" for the limited purpose of enforcement. The phrase ""that court"" refers to the court which has adjudicated upon the petition filed under Sections 47 and 49 for enforcement of the foreign award. In our view, Article 136 of the Limitation Act would not be applicable for the enforcement/execution of a foreign awards, since it is not a decree of a civil court in India.
73. The enforcement of a foreign award as a deemed decree of the High Court concerned [as per the amended Explanation to Section 47 by Act 3 of 2016 confers exclusive jurisdiction on the High Court for execution of foreign awards] would be covered by the residuary provision i.e. Article 137 of the Limitation Act. A three- Judge Bench of this Court in Kerala SEB V. T.P.Kunhaliumma held that the phrase ""any other application"" in Article 137 cannot be interpreted on the principle of ejusdem generis to be applications under the Civil Procedure Code. The phrase ""any other application""
used in Article 137 would include petitions within the word ""applications"", filed under any special enactment. This would be evident from the definition of ""application"" under Section 2(b) of the Limitation Act, which includes a petition. Article 137 stands in isolation from all other Articles in Part I of the Third Division of the Limitation Act, 1963.

74. The exclusion of an application filed under any of the provisions of Order 21 CPC from the purview of Section 5 of the Limitation Act, was brought in by the present Limitation Act, 1963. Under the previous Limitation Act, 1908 there were varying 73/168 CARBP-414-18.odt periods of limitation prescribed by Articles 182 and 183 of the said Act, as well as Section 48 of CPC, 1908. Article 182 provided that the period of limitation for execution of a decree or order of any civil court was 3 years, and in case where a certified copy of the decree or order was registered, the period of limitation was 6 years. Article 183 provided that the period of limitation to enforce a decree or order of a High Court was 6 years. Section 48 CPC (which has since been repealed by Section 28 of the Limitation Act of 1963) provided that the period of limitation for execution a decree was 12 years.

75. The Law Commission in its 3rd Report dated 21-7-1956 noted that different time-limits were prescribed for filing an application for execution of decrees or orders of civil courts. It was recommended that the time-limit should be absolute, and there should be no scope for any further extension of time by acknowledgments. There was no justification for making a distinction between decrees or orders passed by the High Court in exercise of original civil jurisdiction, and other decrees. The maximum period of limitation for the execution of a decree or order of any civil court was fixed at twelve years in the new Limitation Act, 1963 from the date when the decree or order became enforceable. In this background, the present Limitation Act, 1963 excludes any application filed under Order 21 from the purview of Section 5 of the Act, with the object that execution of decrees should be proceeded with as expeditiously as possible. The period of limitation for execution of the decree of a civil court is now uniformly fixed at the maximum period of 12 years for decrees of civil courts.""",,,,examination the evidence of any witness of the opposing party on a material point which he or she wishes to submit to the court should not be accepted. That rule extends to both witnesses as to fact and expert witnesses.,,
,,,,"68. Another tenacious justification offered in support of the conclusion drawn is worded as below :-

""77. The application under Sections 47 and 49 for enforcement of the foreign award, is a substantive petition filed under the Arbitration Act, 1996. It is a well-settled position that the Arbitration Act is a self-contained code. The application under Section 47 is not an application filed under any of the provisions of Order 21 CPC, 1908. The application is filed before the appropriate High Court for enforcement, which would take recourse to the provisions of Order 21 CPC only for the purposes of execution of the foreign award as a deemed decree. The bar contained in Section 5, which excludes an application filed under any of the provisions of Order 21 CPC, would not be applicable to a substantive petition filed under the Arbitration Act, 1996. Consequently, a party may file an application under Section 5 for condonation of delay, if required in the facts and circumstances of the case.""",,,,"(vi) Cross-examination gives the witness the opportunity to explain or clarify his or her evidence. That opportunity is particularly important when the opposing party intends to accuse the witness of 42 (1863) 6 R 67 128/168 CARBP-414-18.odt dishonesty, but there is no principled basis for confining the rule to cases of dishonesty.""",,
,,,,"69. The conundrum as regards the limitation period to be made applicable to the enforcement petition under Sections 47 and 49 has been put to rest by holding that the period of limitation prescribed by Article 136 of the Limitation Act shall be made applicable, but on sufficient grounds being shown to condone the delay in filing the enforcement/execution application, the delay is allowed to be condoned.
Admittedly, the present Petition is not supported by any such application for condonation of delay.",,,,"122. By reading of the aforesaid principles, which has also found its way in the Indian Jurisprudence, being recognized as a principal of natural justice, if there is no cross- examination on a particular point which has surfaced on record through the testimony of a particular witness, in that case the said statement being uncontroverted deserve to be accepted and admitted in evidence. Whenever the opponent has declined to avail himself of the opportunity to put his essential and material case in cross-examination, it must follow that the testimony cannot be disputed at all.",,
,,,,"70. Dealing with the objection that the Petition having been filed after five years, is barred by law of limitation, Mr.Chinoy has urged that once a point of limitation as a preliminary issue in the very same proceedings is decided by an order of this Court on 13/11/2019, holding that the Petition was within limitation, it is not open to E-City to once again raise the same contention. In any case, Mr.Chinoy has urged that the learned Single Judge has accepted the principal submission of the Petitioner that the limitation would be governed by Article 136 and he also accepted the alternative submission on behalf of IMAX that even Article 137 is applied, which has prescribed three years as period of limitation, from the point of time, when the right to apply accrues, it was still within limitation, by recording that as per the law laid down by the Supreme Court in Fiza Developers and Inter-Trade Private Limited Vs. AMCI (India) Private Limited & Anr. 31, the filing of Petition under Section 34 by E-City, operated as a stay on the enforcement of the award and it was only on 10/03/2017, when the Hon'ble Supreme Court dismissed the Section 34 Petition, 31 (2009) 17 SCC 796 75/168 CARBP-414-18.odt the enforcement and execution proceedings could have been entertained on behalf of IMAX.
E-City preferred Special Leave Petition before the Apex Court against the Judgment dated 13/11/2019, which was dismissed on 18/10/2022, which was subsequent to the decision of the Apex Court in the case of Vedanta Limited (supra) against which a review petition was filed, but even the same was dismissed on 16/08/2023. Therefore, according to Mr.Chinoy, issue of limitation stands concluded by the Judgment dated 13/11/2019 and it is not open for E-City to re-
open the said issue.",,,,"124. When the admissions coming from the witness of E-City was not controverted by subjecting him to cross-examination, 129/168 CARBP-414-18.odt I find that the Tribunal derived an inference contrary to what has been deposed by the witness, without affording a chance to explain or clarify the said statement, has definitely resulted into a loss of fair hearing as Mr. Chudasama had unequivocally stated that it was not possible for E-City to have made the remittances without prior approval of Reserve Bank of India, but without going for the cross-examination, the Tribunal has questioned this testimony, expressed doubt and derived at a finding that it was not a mandatory requirement and it was not refused, which definitely has resulted into perversity in its finding.",,
,,,,"The law of limitation is based on the maximum Interest Reipublicae Ut Sit Finis Litium. It is a general principle of general welfare that end should be put to a litigation and the principle is founded on the public policy. Section 3 of the Limitation Act makes it imperative for the Court to dismiss any application, filed beyond the period of limitation, although the point of limitation may be raised as one of the defence. It is only when sufficient cause is shown, the period of limitation is permitted to be extended, as contemplated under Section 5 of the Limitation Act.",,,,"126. In utter contrast, in Para 54, the Tribunal record that according the evidence of Mr. Burman, the Tribunal has no hesitation in accepting that the Reserve Bank of India has given permission for remittances of funds pursuant to other contracts, which other Indian parties have entered into and, therefore, there could have been no difficulty with the RBI in this respect, the contracts being structured in from of Sale and Purchase, rather than IMAX's customary form of lease.",,
,,,,"It is, therefore, when a sufficient cause is shown, the Court may be persuaded to accept the explanation offered and deem it appropriate to condone the delay and entertain the cause, despite it being lodged before the Court beyond the period prescribed for limitation.",,,,"128. I have perused the orders passed by the High Court of Judicature at Bombay, in the Company Petitions, where sanction was sought from the Court to the scheme of demerger under Section 391 to 394 of the Companies Act, 1956.",,
,,,,"72. Another angle to the law of limitation is also to be kept in mind, being on expiration of period of limitation prescribed for instituting the proceedings or making an Appeal, a right accrues in favour of other party, on account of the lapse of time and this right shall not be lightheartedly disturbed. The proof of sufficient cause is a condition precedent for exercise of power vested in the Court under Section 5 of the Limitation Act and the significant consideration would be the diligence of the party and its bona fide.",,,,"It is also specifically stated that the process for re- organization of business of E-City i.e. Respondent No.1 and 133/168 CARBP-414-18.odt demerger of real estate business of the Company was in pursuant to the Direct Automatic Root FDI Policy as a business decision and after receipt of advise of experts, such as APMG and ERNST and Young, this process kick started on 07/06/2005 on which date the Board of Directors of E-City passed a resolution to make the Company FDI compliant and this was much prior to the statement of case by IMAX and even much prior to the passing of Partial Final Award on liability on 09/02/2006. The incorporation of Respondent No.2 was immediately after the announcement of FDI Policy, whereas, incorporation of Respondent No.3 was after the Board Meeting dated 07/06/2005, and it is noted by me that only upon sufficient disclosures and statutory compliances being ensured, the High Court allowed the prayer of demerger in the company petitions in accordance with the Companies Act and the Rules thereunder.",,
